札幌,sapporo
札幌・新札幌・琴似,A
大通公園・時計台・狸小路,B
すすきの・中島公園,C
定山渓,jozankei
稚内・留萌・利尻・礼文,wakkanai
網走・紋別・北見・知床,abashiri
釧路・阿寒・川湯・根室,kushiro
帯広・十勝,obihiro
日高・えりも,hidaka
富良野・美瑛・トマム,furano
旭川・層雲峡・旭岳,asahikawa
千歳・支笏・苫小牧・滝川・夕張・空知,chitose
小樽・キロロ・積丹・余市,otaru
ルスツ・ニセコ・倶知安,niseko
函館・湯の川・大沼・奥尻,hakodate
青森・浅虫温泉,aomori
津軽半島・五所川原,tsugaru
白神山地・西津軽,ntsugaru
弘前・黒石,hirosaki
八甲田・十和田湖・奥入瀬,towadako
八戸・三沢・七戸十和田,hachinohe
下北・大間・むつ,shimokita
盛岡,morioka
雫石,shizukuishi
安比高原・八幡平・二戸,appi
宮古・久慈・岩泉,kuji
釜石・大船渡・陸前高田,ofunato
北上・花巻・遠野,kitakami
奥州・平泉・一関,ichinoseki
仙台・多賀城・名取,sendai
秋保・作並,akiu
鳴子・古川・くりこま高原,naruko
松島・塩釜・石巻・南三陸・気仙沼,matsushima
白石・宮城蔵王,shiroishi
秋田,akita
能代・男鹿・白神,noshiro
大館・鹿角・十和田大湯・八幡平,odate
角館・大曲・田沢湖,tazawa
湯沢・横手,yuzawa
由利本荘・鳥海山,honjo
山形・蔵王・天童・上山,yamagata
米沢・赤湯・高畠・長井,yonezawa
寒河江・月山,sagae
尾花沢・新庄・村山,mogami
酒田・鶴岡・湯野浜・温海,shonai
福島・二本松,fukushima
会津若松・喜多方,aizu
猪苗代・表磐梯,bandai
磐梯高原・裏磐梯,urabandai
郡山・磐梯熱海,koriyama
南会津・下郷・只見・檜枝岐,minami
白河・須賀川,nakadori
いわき・南相馬・相馬,hamadori
水戸・笠間,mito
大洗・ひたちなか,oarai
日立・北茨城・奥久慈,hitachi
つくば・土浦・取手,tsukuba
古河・結城・筑西・常総,yuki
鹿嶋・神栖・潮来・北浦,kashima
宇都宮・さくら,utsunomiya
日光・中禅寺湖・奥日光・今市,nikko
鬼怒川・川治・湯西川・川俣,kinugawa
那須・板室・黒磯,nasu
塩原・矢板・大田原・西那須野,shiobara
真岡・益子・茂木,mashiko
小山・足利・佐野・栃木,koyama
前橋・赤城,maebashi
伊香保温泉・渋川,ikaho
万座･嬬恋･北軽井沢,manza
草津温泉・白根,kusatsu
四万温泉,shimaonsen
水上・猿ヶ京・沼田,numata
尾瀬・丸沼,oze
伊勢崎・太田・館林・桐生,kiryu
高崎,takasaki
富岡・藤岡・安中・磯部温泉,fujioka
大宮・浦和・川口・上尾,saitama
草加・越谷・春日部・羽生,kasukabe
熊谷・深谷・本庄,kumagaya
川越・東松山・志木・和光,kawagoe
所沢・狭山・飯能,tokorozawa
秩父・長瀞,chichibu
千葉,chiba
舞浜・浦安・船橋・幕張,keiyo
松戸・柏,kashiwa
成田空港・佐倉,narita
銚子・旭・九十九里・東金・茂原,choshi
鴨川・勝浦・御宿・養老渓谷,sotobo
南房総・館山・白浜・千倉,tateyama
市原・木更津・君津・富津・鋸南,uchibo
東京駅・銀座・秋葉原・東陽町・葛西,A
新橋・汐留・浜松町・お台場,B
赤坂・六本木・霞ヶ関・永田町,C
渋谷・恵比寿・目黒・二子玉川,D
品川・大井町・蒲田・羽田空港,E
新宿・中野・荻窪・四谷,F
池袋・赤羽・巣鴨・大塚,G
東京ドーム・飯田橋・御茶ノ水,H
上野・浅草・錦糸町・新小岩・北千住,I
立川・八王子・町田・府中・吉祥寺,nishi
奥多摩・青梅・羽村,okutama
八丈島,ritou
大島,oshima
神津島・新島・式根島,kouzu
三宅島,miyake
小笠原諸島,Ogasawara
横浜,yokohama
川崎,kawasaki
箱根,hakone
小田原,odawara
湯河原・真鶴,yugawara
相模湖・丹沢,sagamiko
大和・相模原・町田西部,sagamihara
厚木・海老名・伊勢原,ebina
湘南・鎌倉・江ノ島・藤沢・平塚,shonan
横須賀・三浦,miura
新潟,niigata
月岡・瀬波・咲花,kaetsu
長岡・燕三条・柏崎・弥彦・岩室・寺泊,kita
魚沼・十日町・津南・六日町・大湯,minami
越後湯沢・苗場,yuzawa
上越・糸魚川・妙高,joetsu
佐渡,sado
富山・八尾・立山,toyama
滑川・魚津・朝日・黒部・宇奈月,goto
高岡・氷見・砺波,gosei
金沢,kanazawa
加賀・小松・辰口,kaga
能登・輪島・珠洲,noto
七尾・和倉・羽咋,nanao
福井,hukui
あわら・三国,awara
永平寺・勝山・大野,katsuyama
越前・鯖江・武生,echizen
敦賀・美浜,tsuruga
若狭・小浜・高浜,obama
甲府・湯村・昇仙峡,kofu
山梨・石和・勝沼・塩山,yamanashi
大月・都留・道志渓谷,otsuki
山中湖・忍野,yamanakako
河口湖・富士吉田・本栖湖・西湖・精進湖,kawaguchiko
下部・身延・早川,minobu
韮崎・南アルプス,nirasaki
八ヶ岳・小淵沢・清里・大泉,kiyosato
長野・小布施・信州高山・戸隠・飯綱,nagano
斑尾・飯山・信濃町・野尻湖・黒姫,madara
野沢温泉・木島平・秋山郷,nozawa
志賀高原･湯田中･渋,shiga
上田・別所・鹿教湯,ueda
戸倉上山田・千曲,chikuma
菅平・峰の原,sugadaira
軽井沢・佐久･小諸,karui
八ヶ岳・野辺山・富士見・原村,yatsu
蓼科・白樺湖・霧ヶ峰・車山,kirigamine
諏訪湖,suwa
伊那・駒ヶ根・飯田・昼神,ina
木曽,kiso
松本・塩尻・浅間温泉・美ヶ原温泉,matsumo
上高地・乗鞍・白骨,kamiko
安曇野・穂高・大町・豊科,hotaka
白馬・八方尾根・栂池高原・小谷,hakuba
岐阜・各務原,gifu
奥飛騨・新穂高,kamitakara
高山・飛騨,takayama
下呂温泉・濁河温泉,gero
中津川・多治見・恵那・美濃加茂,tajimi
郡上八幡・関・美濃,gujo
白川郷,shirakawago
大垣・岐阜羽島,ogaki
静岡・清水,shizuoka
熱海,atami
伊東,ito
伊豆高原,izukogen
東伊豆・河津,higashi
下田・南伊豆,shimoda
西伊豆・戸田・土肥・堂ヶ島,nishi
伊豆長岡・修善寺・天城湯ヶ島,naka
富士・富士宮,fuji
御殿場・沼津・三島,numazu
焼津・藤枝・御前崎・寸又峡,yaizu
浜松・浜名湖・天竜,hamamatsu
掛川・袋井・磐田,kikugawa
名古屋駅・伏見・丸の内,A
栄・錦・名古屋城,B
金山・熱田・千種・ナゴヤドーム,C
豊橋・豊川・蒲郡・伊良湖,mikawawan
奥三河・新城・湯谷温泉,okumikawa
豊田・刈谷・知立・安城・岡崎,mikawa
一宮・犬山・小牧・瀬戸・春日井,owari
セントレア・東海・半田・知多,chita
南知多・日間賀島・篠島,minamichita
津･鈴鹿･亀山,tsu
四日市・桑名・湯の山・長島温泉,yunoyama
伊賀・名張,iga
松阪,matsusaka
伊勢・二見,ise
鳥羽,toba
志摩・賢島,shima
熊野・尾鷲・紀北,kumano
大津・雄琴・草津・栗東,ootsu
湖西・高島・マキノ,kosei
長浜・米原,kohoku
彦根・近江八幡・守山・東近江,kotou
信楽・甲賀,shigaraki
京都駅,D
嵐山・嵯峨野・太秦・高雄,A
河原町・四条烏丸・二条城・御所,B
祇園・東山・北白川,C
大原・鞍馬・貴船,E
宇治・長岡京,nannbu
亀岡・湯の花・美山・京丹波,yunohana
福知山・綾部,fukuchiyama
丹後・久美浜,hokubu
天橋立・宮津・舞鶴,miyazu
大阪駅・梅田・ユニバーサルシティ・尼崎,B
なんば・心斎橋・天王寺・阿倍野・長居,D
京橋・淀屋橋・本町・ベイエリア・弁天町,C
新大阪・江坂,A
高槻・茨木・箕面・伊丹空港,hokubu
枚方・守口・東大阪,toubu
八尾・藤井寺・河内長野,nantou
堺・岸和田・関空・泉佐野,nanbu
神戸・有馬温泉・六甲山,kobe
宝塚・西宮・甲子園・三田・篠山,nantou
明石・加古川・三木,minamichu
姫路・相生・赤穂,nannansei
和田山・竹田城・ハチ高原,chubu
城崎温泉・豊岡・出石・神鍋,kita
香住・浜坂・湯村,kasumi
淡路島,awaji
奈良・大和高原,nara
橿原・大和郡山・天理・生駒,hokubu
吉野・十津川・天川・五條,nanbu
和歌山・加太・和歌浦,wakayama
高野山・橋本,Kihoku
御坊・有田・海南・日高,gobo
南紀白浜・紀伊田辺・龍神,shirahama
勝浦・串本・すさみ,Katsuura
熊野古道・新宮・本宮・中辺路,hongu
鳥取・岩美・浜村,tottori
倉吉・三朝温泉,chubu
米子・皆生温泉・大山,seibu
松江・玉造・安来・奥出雲,matsue
出雲・大田・石見銀山,toubu
津和野・益田・浜田・江津,masuda
隠岐諸島,ritou
岡山,okayama
牛窓・瀬戸内・備前,bizen
津山・湯郷・美作・奥津,tsuyama
湯原・蒜山・新見・高梁,niimi
倉敷・総社・玉野・笠岡,kurashiki
広島,hiroshima
東広島・竹原・三原・広島空港,higashihiroshima
福山・尾道・しまなみ海道,fukuyama
呉・江田島,kure
三次・庄原・帝釈峡,shohara
三段峡・芸北・北広島,sandankyo
宮島・宮浜温泉・廿日市,miyajima
山口・湯田温泉・防府,yamaguchi
下関・宇部,shimonoseki
岩国・周南・柳井,iwakuni
萩・長門・秋吉台,hagi
徳島・鳴門,tokushima
大歩危・祖谷・剣山・吉野川,hokubu
阿南・日和佐・宍喰,nanbu
高松・さぬき・東かがわ,takamatsu
坂出・宇多津・丸亀,sakaide
琴平・観音寺,kotohira
小豆島・直島,ritou
松山・道後,chuuyo
今治・しまなみ海道,touyo
西条・新居浜・四国中央,saijo
宇和島・八幡浜,nanyo
高知・南国・香南・伊野,kouchi
安芸・室戸,toubu
足摺・四万十・宿毛・須崎,seibu
博多・キャナルシティ・海の中道・太宰府・二日市,fukuoka
天神・中洲・薬院・福岡ドーム・糸島,seibu
北九州,kitakyusyu
宗像・宮若・飯塚,chikuzen
久留米・甘木・原鶴温泉・筑後川温泉,kurume
北九州空港・苅田・行橋・豊前,buzen
大牟田・柳川・八女・筑後,chikugo
佐賀・古湯温泉,saga
鳥栖,tosu
嬉野・武雄・伊万里・有田・太良,ureshino
唐津・呼子,karatsu
長崎,nagasaki
雲仙・島原・小浜,unzen
諫早・大村・長崎空港,airport
ハウステンボス・佐世保・平戸,sasebo
五島列島,ritou
対馬,tsushima
壱岐島,iki
熊本,kumamoto
大津・玉名・山鹿・荒尾・菊池,kikuchi
阿蘇,aso
宇土・八代・水俣,yatsushiro
人吉・球磨,kuma
天草･本渡,amakusa
黒川温泉・杖立,kurokawa
大分,oita
別府・日出,beppu
佐伯・臼杵・豊後大野,usuki
湯布院・湯平,yufuin
久住・竹田,taketa
九重・日田・天瀬,hita
国東・中津・宇佐・耶馬渓,kunisaki
宮崎,miyazaki
高千穂・延岡・日向・高鍋,hokubu
都城・えびの・日南・綾,nanbu
鹿児島・桜島,kagoshima
霧島・国分・鹿児島空港,oosumi
鹿屋・垂水・志布志,kanoya
川内・出水,hokusatsu
指宿・枕崎・南さつま,nansatsu
屋久島,yakushima
種子島,ritou
奄美大島･喜界島・徳之島,amami
沖永良部島・与論島,okinoerabu
那覇,nahashi
恩納・名護・本部・今帰仁,hokubu
宜野湾・北谷・読谷・沖縄市・うるま,chubu
糸満・豊見城・南城,nanbu
慶良間・渡嘉敷・座間味・阿嘉,kerama
久米島,kumejima
宮古島・伊良部島,Miyako
石垣・西表・小浜島,ritou
与那国島,yonaguni
大東島,daito